{"access":{"visibility":"unlisted"},"annotations":{"example.note":"portable","example.version":2},"artifactType":"application/vnd.openwebartifact.site.v1+json","entrypoint":"/index.html","files":[{"digest":"sha256:f6c64c97726aac94c47f997a6875c727f8a889043393bd398fe008e3edeb63b0","mediaType":"text/html; charset=utf-8","path":"/index.html","size":10}],"lifecycle":{"expiresAt":null},"specVersion":"owa.dev/v1"}